<!ELEMENT compras (compra*)>
<!ELEMENT compra (articulo*)>
<!ELEMENT articulo (#PCDATA)>
<!ATTLIST compra
  id CDATA #REQUIRED
  clientID CDATA #REQUIRED
  precio CDATA #REQUIRED
 >
 <!ATTLIST articulo
  codigo CDATA #REQUIRED
  nombre CDATA #REQUIRED
  precio CDATA #REQUIRED>